  1   0.000000 Vmware_78:a2:03 -> SamsungE_3a:e0:bb ARP Who has 192.168.23.172?  Tell 192.168.23.32
  2   0.022728 SamsungE_3a:e0:bb -> Vmware_7e:49:32 ARP Who has 192.168.23.24?  Tell 192.168.23.172
  3   0.023154 Vmware_7e:49:32 -> SamsungE_3a:e0:bb ARP 192.168.23.24 is at 00:0c:29:7e:49:32
  4   0.025092 SamsungE_3a:e0:bb -> Vmware_78:a2:03 ARP 192.168.23.172 is at e8:03:9a:3a:e0:bb
  5   0.028321 HewlettP_2d:e0:60 -> Broadcast    ARP Who has 192.168.23.213?  Tell 192.168.23.20
  6   0.045644 192.168.23.172 -> 192.168.23.32 ICMP Echo (ping) request  id=0x0ed2, seq=91/23296, ttl=64
  7   0.071050 192.168.23.32 -> 192.168.23.172 ICMP Echo (ping) reply    id=0x0ed2, seq=91/23296, ttl=64
  8   0.096666 192.168.23.172 -> 192.168.23.1 DNS Standard query 0x3557  PTR 32.23.168.192.in-addr.arpa
  9   0.097253 192.168.23.1 -> 192.168.23.172 DNS Standard query response 0x3557 No such name
 10   1.028327 HewlettP_2d:e0:60 -> Broadcast    ARP Who has 192.168.23.213?  Tell 192.168.23.20
 11   1.956208 192.168.23.188 -> 255.255.255.255 DB-LSP-DISC Dropbox LAN sync Discovery Protocol
 12   1.956268 192.168.23.188 -> 192.168.23.255 DB-LSP-DISC Dropbox LAN sync Discovery Protocol
 13   2.028315 HewlettP_2d:e0:60 -> Broadcast    ARP Who has 192.168.23.213?  Tell 192.168.23.20
 14   2.084477 192.168.23.172 -> 192.168.23.32 TCP 49567 > http [SYN] Seq=0 Win=29200 Len=0 MSS=1460 SACK_PERM=1 TSval=620563 TSecr=0 WS=128
 15   2.113866 192.168.23.32 -> 192.168.23.172 TCP http > 49567 [SYN, ACK] Seq=0 Ack=1 Win=14480 Len=0 MSS=1460 SACK_PERM=1 TSval=2141929896 TSecr=620563 WS=128
 16   2.138995 192.168.23.172 -> 192.168.23.32 TCP 49567 > http [ACK] Seq=1 Ack=1 Win=29312 Len=0 TSval=620577 TSecr=2141929896
 17   2.139182 192.168.23.172 -> 192.168.23.32 HTTP GET /tmp/Mati.avi HTTP/1.1 
 18   2.164750 192.168.23.32 -> 192.168.23.172 TCP http > 49567 [ACK] Seq=1 Ack=126 Win=14592 Len=0 TSval=2141929909 TSecr=620577
 19   2.167120 192.168.23.32 -> 192.168.23.172 TCP [TCP segment of a reassembled PDU]
 20   2.167269 192.168.23.32 -> 192.168.23.172 TCP [TCP segment of a reassembled PDU]
 21   2.167370 192.168.23.32 -> 192.168.23.172 TCP [TCP segment of a reassembled PDU]
 22   2.167512 192.168.23.32 -> 192.168.23.172 TCP [TCP segment of a reassembled PDU]
 23   2.167628 192.168.23.32 -> 192.168.23.172 TCP [TCP segment of a reassembled PDU]
 24   2.167746 192.168.23.32 -> 192.168.23.172 TCP [TCP segment of a reassembled PDU]
 25   2.167871 192.168.23.32 -> 192.168.23.172 TCP [TCP segment of a reassembled PDU]
 26   2.167997 192.168.23.32 -> 192.168.23.172 TCP [TCP segment of a reassembled PDU]
 27   2.168112 192.168.23.32 -> 192.168.23.172 TCP [TCP segment of a reassembled PDU]
 28   2.192247 192.168.23.172 -> 192.168.23.32 TCP 49567 > http [ACK] Seq=126 Ack=2897 Win=35072 Len=0 TSval=620590 TSecr=2141929909
 29   2.192313 192.168.23.172 -> 192.168.23.32 TCP 49567 > http [ACK] Seq=126 Ack=4345 Win=37888 Len=0 TSval=620590 TSecr=2141929909
 30   2.192396 192.168.23.172 -> 192.168.23.32 TCP 49567 > http [ACK] Seq=126 Ack=5793 Win=40832 Len=0 TSval=620590 TSecr=2141929909
 31   2.192556 192.168.23.172 -> 192.168.23.32 TCP 49567 > http [ACK] Seq=126 Ack=7241 Win=41728 Len=0 TSval=620590 TSecr=2141929909
 32   2.192678 192.168.23.172 -> 192.168.23.32 TCP 49567 > http [ACK] Seq=126 Ack=8689 Win=40704 Len=0 TSval=620590 TSecr=2141929909
 33   2.192763 192.168.23.172 -> 192.168.23.32 TCP 49567 > http [ACK] Seq=126 Ack=10137 Win=39808 Len=0 TSval=620590 TSecr=2141929909
 34   2.192910 192.168.23.172 -> 192.168.23.32 TCP 49567 > http [ACK] Seq=126 Ack=11585 Win=45184 Len=0 TSval=620590 TSecr=2141929909
 35   2.193026 192.168.23.172 -> 192.168.23.32 TCP 49567 > http [ACK] Seq=126 Ack=13033 Win=45184 Len=0 TSval=620590 TSecr=2141929909
 36   2.193155 192.168.23.172 -> 192.168.23.32 TCP 49567 > http [ACK] Seq=126 Ack=14481 Win=45184 Len=0 TSval=620590 TSecr=2141929909
 37   2.218744 192.168.23.32 -> 192.168.23.172 TCP [TCP segment of a reassembled PDU]
 38   2.218857 192.168.23.32 -> 192.168.23.172 TCP [TCP segment of a reassembled PDU]
 39   2.218986 192.168.23.32 -> 192.168.23.172 TCP [TCP segment of a reassembled PDU]
 40   2.219116 192.168.23.32 -> 192.168.23.172 TCP [TCP segment of a reassembled PDU]
 41   2.219228 192.168.23.32 -> 192.168.23.172 TCP [TCP segment of a reassembled PDU]
 42   2.219359 192.168.23.32 -> 192.168.23.172 TCP [TCP segment of a reassembled PDU]
 43   2.219479 192.168.23.32 -> 192.168.23.172 TCP [TCP segment of a reassembled PDU]
 44   2.219606 192.168.23.32 -> 192.168.23.172 TCP [TCP segment of a reassembled PDU]
 45   2.219723 192.168.23.32 -> 192.168.23.172 TCP [TCP segment of a reassembled PDU]
 46   2.219854 192.168.23.32 -> 192.168.23.172 TCP [TCP segment of a reassembled PDU]
 47   2.219966 192.168.23.32 -> 192.168.23.172 TCP [TCP segment of a reassembled PDU]
 48   2.220099 192.168.23.32 -> 192.168.23.172 TCP [TCP segment of a reassembled PDU]
 49   2.243804 192.168.23.172 -> 192.168.23.32 TCP 49567 > http [ACK] Seq=126 Ack=15929 Win=45184 Len=0 TSval=620603 TSecr=2141929922
 50   2.243883 192.168.23.172 -> 192.168.23.32 TCP 49567 > http [ACK] Seq=126 Ack=17377 Win=44544 Len=0 TSval=620603 TSecr=2141929922
 51   2.244015 192.168.23.172 -> 192.168.23.32 TCP 49567 > http [ACK] Seq=126 Ack=18825 Win=45184 Len=0 TSval=620603 TSecr=2141929922
 52   2.244137 192.168.23.172 -> 192.168.23.32 TCP 49567 > http [ACK] Seq=126 Ack=20273 Win=44544 Len=0 TSval=620603 TSecr=2141929922
 53   2.244252 192.168.23.172 -> 192.168.23.32 TCP 49567 > http [ACK] Seq=126 Ack=21721 Win=45184 Len=0 TSval=620603 TSecr=2141929922
 54   2.244383 192.168.23.172 -> 192.168.23.32 TCP 49567 > http [ACK] Seq=126 Ack=23169 Win=45184 Len=0 TSval=620603 TSecr=2141929922
 55   2.244629 192.168.23.172 -> 192.168.23.32 TCP 49567 > http [ACK] Seq=126 Ack=26065 Win=45184 Len=0 TSval=620603 TSecr=2141929922
 56   2.244877 192.168.23.172 -> 192.168.23.32 TCP 49567 > http [ACK] Seq=126 Ack=28961 Win=45184 Len=0 TSval=620603 TSecr=2141929922
 57   2.245121 192.168.23.172 -> 192.168.23.32 TCP 49567 > http [ACK] Seq=126 Ack=31857 Win=45184 Len=0 TSval=620603 TSecr=2141929922
 58   2.269514 192.168.23.32 -> 192.168.23.172 TCP [TCP segment of a reassembled PDU]
 59   2.269669 192.168.23.32 -> 192.168.23.172 TCP [TCP segment of a reassembled PDU]
 60   2.269802 192.168.23.32 -> 192.168.23.172 TCP [TCP segment of a reassembled PDU]
 61   2.269907 192.168.23.32 -> 192.168.23.172 TCP [TCP segment of a reassembled PDU]
 62   2.270036 192.168.23.32 -> 192.168.23.172 TCP [TCP segment of a reassembled PDU]
 63   2.270149 192.168.23.32 -> 192.168.23.172 TCP [TCP segment of a reassembled PDU]
 64   2.270281 192.168.23.32 -> 192.168.23.172 TCP [TCP segment of a reassembled PDU]
 65   2.270467 192.168.23.32 -> 192.168.23.172 TCP [TCP segment of a reassembled PDU]
 66   2.270677 192.168.23.32 -> 192.168.23.172 TCP [TCP segment of a reassembled PDU]
 67   2.270778 192.168.23.32 -> 192.168.23.172 TCP [TCP segment of a reassembled PDU]
 68   2.270908 192.168.23.32 -> 192.168.23.172 TCP [TCP segment of a reassembled PDU]
 69   2.271020 192.168.23.32 -> 192.168.23.172 TCP [TCP segment of a reassembled PDU]
 70   2.271152 192.168.23.32 -> 192.168.23.172 TCP [TCP segment of a reassembled PDU]
 71   2.271266 192.168.23.32 -> 192.168.23.172 TCP [TCP segment of a reassembled PDU]
 72   2.271396 192.168.23.32 -> 192.168.23.172 TCP [TCP segment of a reassembled PDU]
 73   2.271510 192.168.23.32 -> 192.168.23.172 TCP [TCP segment of a reassembled PDU]
 74   2.271642 192.168.23.32 -> 192.168.23.172 TCP [TCP segment of a reassembled PDU]
 75   2.271756 192.168.23.32 -> 192.168.23.172 TCP [TCP segment of a reassembled PDU]
 76   2.271887 192.168.23.32 -> 192.168.23.172 TCP [TCP segment of a reassembled PDU]
 77   2.294767 192.168.23.172 -> 192.168.23.32 TCP 49567 > http [ACK] Seq=126 Ack=36201 Win=45184 Len=0 TSval=620616 TSecr=2141929935
 78   2.294946 192.168.23.172 -> 192.168.23.32 TCP 49567 > http [ACK] Seq=126 Ack=39097 Win=45184 Len=0 TSval=620616 TSecr=2141929935
 79   2.295240 192.168.23.172 -> 192.168.23.32 TCP 49567 > http [ACK] Seq=126 Ack=41993 Win=45184 Len=0 TSval=620616 TSecr=2141929935
 80   2.295564 192.168.23.172 -> 192.168.23.32 TCP 49567 > http [ACK] Seq=126 Ack=46337 Win=45184 Len=0 TSval=620616 TSecr=2141929935
 81   2.295812 192.168.23.172 -> 192.168.23.32 TCP 49567 > http [ACK] Seq=126 Ack=49233 Win=45184 Len=0 TSval=620616 TSecr=2141929935
 82   2.296052 192.168.23.172 -> 192.168.23.32 TCP 49567 > http [ACK] Seq=126 Ack=52129 Win=45184 Len=0 TSval=620616 TSecr=2141929935
 83   2.296291 192.168.23.172 -> 192.168.23.32 TCP 49567 > http [ACK] Seq=126 Ack=55025 Win=45184 Len=0 TSval=620616 TSecr=2141929935
 84   2.296531 192.168.23.172 -> 192.168.23.32 TCP 49567 > http [ACK] Seq=126 Ack=57921 Win=45184 Len=0 TSval=620616 TSecr=2141929935
 85   2.296777 192.168.23.172 -> 192.168.23.32 TCP 49567 > http [ACK] Seq=126 Ack=60817 Win=45184 Len=0 TSval=620616 TSecr=2141929935
 86   2.320364 192.168.23.32 -> 192.168.23.172 TCP [TCP segment of a reassembled PDU]
 87   2.320467 192.168.23.32 -> 192.168.23.172 TCP [TCP segment of a reassembled PDU]
 88   2.320598 192.168.23.32 -> 192.168.23.172 TCP [TCP segment of a reassembled PDU]
 89   2.320716 192.168.23.32 -> 192.168.23.172 TCP [TCP segment of a reassembled PDU]
 90   2.320844 192.168.23.32 -> 192.168.23.172 TCP [TCP segment of a reassembled PDU]
 91   2.320963 192.168.23.32 -> 192.168.23.172 TCP [TCP segment of a reassembled PDU]
 92   2.321093 192.168.23.32 -> 192.168.23.172 TCP [TCP segment of a reassembled PDU]
 93   2.321202 192.168.23.32 -> 192.168.23.172 TCP [TCP segment of a reassembled PDU]
 94   2.321386 192.168.23.32 -> 192.168.23.172 TCP [TCP segment of a reassembled PDU]
 95   2.321593 192.168.23.32 -> 192.168.23.172 TCP [TCP segment of a reassembled PDU]
 96   2.321699 192.168.23.32 -> 192.168.23.172 TCP [TCP segment of a reassembled PDU]
 97   2.321832 192.168.23.32 -> 192.168.23.172 TCP [TCP segment of a reassembled PDU]
 98   2.321951 192.168.23.32 -> 192.168.23.172 TCP [TCP segment of a reassembled PDU]
 99   2.322073 192.168.23.32 -> 192.168.23.172 TCP [TCP segment of a reassembled PDU]
100   2.322203 192.168.23.32 -> 192.168.23.172 TCP [TCP segment of a reassembled PDU]
101   2.322316 192.168.23.32 -> 192.168.23.172 TCP [TCP segment of a reassembled PDU]
102   2.322449 192.168.23.32 -> 192.168.23.172 TCP [TCP segment of a reassembled PDU]
103   2.322562 192.168.23.32 -> 192.168.23.172 TCP [TCP segment of a reassembled PDU]
104   2.322694 192.168.23.32 -> 192.168.23.172 TCP [TCP segment of a reassembled PDU]
105   2.322809 192.168.23.32 -> 192.168.23.172 TCP [TCP segment of a reassembled PDU]
106   2.322941 192.168.23.32 -> 192.168.23.172 TCP [TCP segment of a reassembled PDU]
107   2.323054 192.168.23.32 -> 192.168.23.172 TCP [TCP segment of a reassembled PDU]
108   2.323189 192.168.23.32 -> 192.168.23.172 TCP [TCP segment of a reassembled PDU]
109   2.323300 192.168.23.32 -> 192.168.23.172 TCP [TCP segment of a reassembled PDU]
110   2.334642 192.168.23.172 -> 192.168.23.32 TCP 49567 > http [ACK] Seq=126 Ack=62265 Win=45184 Len=0 TSval=620626 TSecr=2141929935
111   2.345491 192.168.23.172 -> 192.168.23.32 TCP 49567 > http [ACK] Seq=126 Ack=65161 Win=48128 Len=0 TSval=620628 TSecr=2141929948
112   2.345634 192.168.23.172 -> 192.168.23.32 TCP 49567 > http [ACK] Seq=126 Ack=66609 Win=50944 Len=0 TSval=620628 TSecr=2141929948
113   2.345750 192.168.23.172 -> 192.168.23.32 TCP 49567 > http [ACK] Seq=126 Ack=68057 Win=53888 Len=0 TSval=620628 TSecr=2141929948
114   2.345865 192.168.23.172 -> 192.168.23.32 TCP 49567 > http [ACK] Seq=126 Ack=69505 Win=54400 Len=0 TSval=620628 TSecr=2141929948
115   2.346119 192.168.23.172 -> 192.168.23.32 TCP 49567 > http [ACK] Seq=126 Ack=72401 Win=55040 Len=0 TSval=620628 TSecr=2141929948
116   2.346470 192.168.23.172 -> 192.168.23.32 TCP 49567 > http [ACK] Seq=126 Ack=76745 Win=55040 Len=0 TSval=620628 TSecr=2141929948
117   2.346745 192.168.23.172 -> 192.168.23.32 TCP 49567 > http [ACK] Seq=126 Ack=79641 Win=55040 Len=0 TSval=620629 TSecr=2141929948
118   2.346980 192.168.23.172 -> 192.168.23.32 TCP 49567 > http [ACK] Seq=126 Ack=82537 Win=55040 Len=0 TSval=620629 TSecr=2141929948
119   2.347227 192.168.23.172 -> 192.168.23.32 TCP 49567 > http [ACK] Seq=126 Ack=85433 Win=55040 Len=0 TSval=620629 TSecr=2141929948
120   2.347472 192.168.23.172 -> 192.168.23.32 TCP 49567 > http [ACK] Seq=126 Ack=88329 Win=55040 Len=0 TSval=620629 TSecr=2141929948
121   2.347716 192.168.23.172 -> 192.168.23.32 TCP 49567 > http [ACK] Seq=126 Ack=91225 Win=55040 Len=0 TSval=620629 TSecr=2141929948
122   2.347962 192.168.23.172 -> 192.168.23.32 TCP 49567 > http [ACK] Seq=126 Ack=94121 Win=55040 Len=0 TSval=620629 TSecr=2141929948
123   2.348213 192.168.23.172 -> 192.168.23.32 TCP 49567 > http [ACK] Seq=126 Ack=97017 Win=55040 Len=0 TSval=620629 TSecr=2141929948
124   2.360232 192.168.23.32 -> 192.168.23.172 TCP [TCP segment of a reassembled PDU]
125   2.371125 192.168.23.32 -> 192.168.23.172 TCP [TCP segment of a reassembled PDU]
126   2.371305 192.168.23.32 -> 192.168.23.172 TCP [TCP segment of a reassembled PDU]
127   2.371440 192.168.23.32 -> 192.168.23.172 TCP [TCP segment of a reassembled PDU]
128   2.371556 192.168.23.32 -> 192.168.23.172 TCP [TCP segment of a reassembled PDU]
129   2.371686 192.168.23.32 -> 192.168.23.172 TCP [TCP segment of a reassembled PDU]
130   2.371814 192.168.23.32 -> 192.168.23.172 TCP [TCP segment of a reassembled PDU]
131   2.371933 192.168.23.32 -> 192.168.23.172 TCP [TCP segment of a reassembled PDU]
132   2.372052 192.168.23.32 -> 192.168.23.172 TCP [TCP segment of a reassembled PDU]
133   2.372178 192.168.23.32 -> 192.168.23.172 TCP [TCP segment of a reassembled PDU]
134   2.372289 192.168.23.32 -> 192.168.23.172 TCP [TCP segment of a reassembled PDU]
135   2.372420 192.168.23.32 -> 192.168.23.172 TCP [TCP segment of a reassembled PDU]
136   2.372536 192.168.23.32 -> 192.168.23.172 TCP [TCP segment of a reassembled PDU]
137   2.372666 192.168.23.32 -> 192.168.23.172 TCP [TCP segment of a reassembled PDU]
138   2.372780 192.168.23.32 -> 192.168.23.172 TCP [TCP segment of a reassembled PDU]
139   2.372910 192.168.23.32 -> 192.168.23.172 TCP [TCP segment of a reassembled PDU]
140   2.373026 192.168.23.32 -> 192.168.23.172 TCP [TCP segment of a reassembled PDU]
141   2.373156 192.168.23.32 -> 192.168.23.172 TCP [TCP segment of a reassembled PDU]
142   2.373273 192.168.23.32 -> 192.168.23.172 TCP [TCP segment of a reassembled PDU]
143   2.373402 192.168.23.32 -> 192.168.23.172 TCP [TCP segment of a reassembled PDU]
144   2.373518 192.168.23.32 -> 192.168.23.172 TCP [TCP segment of a reassembled PDU]
145   2.373649 192.168.23.32 -> 192.168.23.172 TCP [TCP segment of a reassembled PDU]
146   2.373762 192.168.23.32 -> 192.168.23.172 TCP [TCP segment of a reassembled PDU]
147   2.373895 192.168.23.32 -> 192.168.23.172 TCP [TCP segment of a reassembled PDU]
148   2.374008 192.168.23.32 -> 192.168.23.172 TCP [TCP segment of a reassembled PDU]
149   2.385269 192.168.23.172 -> 192.168.23.32 TCP 49567 > http [ACK] Seq=126 Ack=99913 Win=55040 Len=0 TSval=620638 TSecr=2141929948
150   2.396280 192.168.23.172 -> 192.168.23.32 TCP 49567 > http [ACK] Seq=126 Ack=102809 Win=55040 Len=0 TSval=620641 TSecr=2141929960
151   2.396338 192.168.23.172 -> 192.168.23.32 TCP 49567 > http [ACK] Seq=126 Ack=104257 Win=57984 Len=0 TSval=620641 TSecr=2141929960
152   2.396479 192.168.23.172 -> 192.168.23.32 TCP 49567 > http [ACK] Seq=126 Ack=105705 Win=60928 Len=0 TSval=620641 TSecr=2141929960
153   2.396589 192.168.23.172 -> 192.168.23.32 TCP 49567 > http [ACK] Seq=126 Ack=107153 Win=63744 Len=0 TSval=620641 TSecr=2141929960
154   2.396714 192.168.23.172 -> 192.168.23.32 TCP 49567 > http [ACK] Seq=126 Ack=108601 Win=66688 Len=0 TSval=620641 TSecr=2141929960
155   2.396844 192.168.23.172 -> 192.168.23.32 TCP 49567 > http [ACK] Seq=126 Ack=110049 Win=69504 Len=0 TSval=620641 TSecr=2141929960
156   2.396958 192.168.23.172 -> 192.168.23.32 TCP 49567 > http [ACK] Seq=126 Ack=111497 Win=72448 Len=0 TSval=620641 TSecr=2141929960
157   2.397081 192.168.23.172 -> 192.168.23.32 TCP 49567 > http [ACK] Seq=126 Ack=112945 Win=75392 Len=0 TSval=620641 TSecr=2141929960
158   2.397206 192.168.23.172 -> 192.168.23.32 TCP 49567 > http [ACK] Seq=126 Ack=114393 Win=78208 Len=0 TSval=620641 TSecr=2141929960
159   2.397445 192.168.23.172 -> 192.168.23.32 TCP 49567 > http [ACK] Seq=126 Ack=117289 Win=78208 Len=0 TSval=620641 TSecr=2141929960
160   2.397689 192.168.23.172 -> 192.168.23.32 TCP 49567 > http [ACK] Seq=126 Ack=120185 Win=78208 Len=0 TSval=620641 TSecr=2141929961
161   2.397935 192.168.23.172 -> 192.168.23.32 TCP 49567 > http [ACK] Seq=126 Ack=123081 Win=78208 Len=0 TSval=620641 TSecr=2141929961
162   2.398184 192.168.23.172 -> 192.168.23.32 TCP 49567 > http [ACK] Seq=126 Ack=125977 Win=78208 Len=0 TSval=620641 TSecr=2141929961
163   2.398432 192.168.23.172 -> 192.168.23.32 TCP 49567 > http [ACK] Seq=126 Ack=128873 Win=78208 Len=0 TSval=620641 TSecr=2141929961
164   2.398676 192.168.23.172 -> 192.168.23.32 TCP 49567 > http [ACK] Seq=126 Ack=131769 Win=78208 Len=0 TSval=620642 TSecr=2141929961
165   2.398922 192.168.23.172 -> 192.168.23.32 TCP 49567 > http [ACK] Seq=126 Ack=134665 Win=78208 Len=0 TSval=620642 TSecr=2141929961
166   2.410937 192.168.23.32 -> 192.168.23.172 TCP [TCP segment of a reassembled PDU]
167   2.421910 192.168.23.32 -> 192.168.23.172 TCP [TCP segment of a reassembled PDU]
168   2.422083 192.168.23.32 -> 192.168.23.172 TCP [TCP segment of a reassembled PDU]
169   2.422212 192.168.23.32 -> 192.168.23.172 TCP [TCP segment of a reassembled PDU]
170   2.422345 192.168.23.32 -> 192.168.23.172 TCP [TCP segment of a reassembled PDU]
171   2.422463 192.168.23.32 -> 192.168.23.172 TCP [TCP segment of a reassembled PDU]
172   2.422590 192.168.23.32 -> 192.168.23.172 TCP [TCP segment of a reassembled PDU]
173   2.422705 192.168.23.32 -> 192.168.23.172 TCP [TCP segment of a reassembled PDU]
174   2.422898 192.168.23.32 -> 192.168.23.172 TCP [TCP segment of a reassembled PDU]
175   2.423108 192.168.23.32 -> 192.168.23.172 TCP [TCP segment of a reassembled PDU]
176   2.423211 192.168.23.32 -> 192.168.23.172 TCP [TCP segment of a reassembled PDU]
177   2.423341 192.168.23.32 -> 192.168.23.172 TCP [TCP segment of a reassembled PDU]
178   2.423454 192.168.23.32 -> 192.168.23.172 TCP [TCP segment of a reassembled PDU]
179   2.423586 192.168.23.32 -> 192.168.23.172 TCP [TCP segment of a reassembled PDU]
180   2.423701 192.168.23.32 -> 192.168.23.172 TCP [TCP segment of a reassembled PDU]
181   2.423831 192.168.23.32 -> 192.168.23.172 TCP [TCP segment of a reassembled PDU]
182   2.423947 192.168.23.32 -> 192.168.23.172 TCP [TCP segment of a reassembled PDU]
183   2.424077 192.168.23.32 -> 192.168.23.172 TCP [TCP segment of a reassembled PDU]
184   2.424193 192.168.23.32 -> 192.168.23.172 TCP [TCP segment of a reassembled PDU]
185   2.424323 192.168.23.32 -> 192.168.23.172 TCP [TCP segment of a reassembled PDU]
186   2.424438 192.168.23.32 -> 192.168.23.172 TCP [TCP segment of a reassembled PDU]
187   2.424569 192.168.23.32 -> 192.168.23.172 TCP [TCP segment of a reassembled PDU]
188   2.424687 192.168.23.32 -> 192.168.23.172 TCP [TCP segment of a reassembled PDU]
189   2.424815 192.168.23.32 -> 192.168.23.172 TCP [TCP segment of a reassembled PDU]
190   2.424930 192.168.23.32 -> 192.168.23.172 TCP [TCP segment of a reassembled PDU]
191   2.436018 192.168.23.172 -> 192.168.23.32 TCP 49567 > http [ACK] Seq=126 Ack=139009 Win=78208 Len=0 TSval=620651 TSecr=2141929961
192   2.446985 192.168.23.172 -> 192.168.23.32 TCP 49567 > http [ACK] Seq=126 Ack=141905 Win=78208 Len=0 TSval=620654 TSecr=2141929973
193   2.447250 192.168.23.172 -> 192.168.23.32 TCP 49567 > http [ACK] Seq=126 Ack=144801 Win=78208 Len=0 TSval=620654 TSecr=2141929973
194   2.447487 192.168.23.172 -> 192.168.23.32 TCP 49567 > http [ACK] Seq=126 Ack=147697 Win=78208 Len=0 TSval=620654 TSecr=2141929973
195   2.447733 192.168.23.172 -> 192.168.23.32 TCP 49567 > http [ACK] Seq=126 Ack=150593 Win=78208 Len=0 TSval=620654 TSecr=2141929973
196   2.447939 192.168.23.172 -> 192.168.23.32 TCP 49567 > http [ACK] Seq=126 Ack=153489 Win=78208 Len=0 TSval=620654 TSecr=2141929973
197   2.448230 192.168.23.172 -> 192.168.23.32 TCP 49567 > http [ACK] Seq=126 Ack=156385 Win=78208 Len=0 TSval=620654 TSecr=2141929973
198   2.448476 192.168.23.172 -> 192.168.23.32 TCP 49567 > http [ACK] Seq=126 Ack=159281 Win=78208 Len=0 TSval=620654 TSecr=2141929973
199   2.448723 192.168.23.172 -> 192.168.23.32 TCP 49567 > http [ACK] Seq=126 Ack=162177 Win=78208 Len=0 TSval=620654 TSecr=2141929973
200   2.448969 192.168.23.172 -> 192.168.23.32 TCP 49567 > http [ACK] Seq=126 Ack=165073 Win=78208 Len=0 TSval=620654 TSecr=2141929973
201   2.449215 192.168.23.172 -> 192.168.23.32 TCP 49567 > http [ACK] Seq=126 Ack=167969 Win=78208 Len=0 TSval=620654 TSecr=2141929973
202   2.449459 192.168.23.172 -> 192.168.23.32 TCP 49567 > http [ACK] Seq=126 Ack=170865 Win=78208 Len=0 TSval=620654 TSecr=2141929973
203   2.449709 192.168.23.172 -> 192.168.23.32 TCP 49567 > http [ACK] Seq=126 Ack=173761 Win=78208 Len=0 TSval=620654 TSecr=2141929973
204   2.449952 192.168.23.172 -> 192.168.23.32 TCP 49567 > http [ACK] Seq=126 Ack=176657 Win=78208 Len=0 TSval=620654 TSecr=2141929974
205   2.461767 192.168.23.32 -> 192.168.23.172 TCP [TCP segment of a reassembled PDU]
206   2.461876 192.168.23.32 -> 192.168.23.172 TCP [TCP segment of a reassembled PDU]
207   2.472595 192.168.23.32 -> 192.168.23.172 TCP [TCP segment of a reassembled PDU]
208   2.472691 192.168.23.32 -> 192.168.23.172 TCP [TCP segment of a reassembled PDU]
209   2.472876 192.168.23.32 -> 192.168.23.172 TCP [TCP segment of a reassembled PDU]
210   2.473067 192.168.23.32 -> 192.168.23.172 TCP [TCP segment of a reassembled PDU]
211   2.473191 192.168.23.32 -> 192.168.23.172 TCP [TCP segment of a reassembled PDU]
212   2.473326 192.168.23.32 -> 192.168.23.172 TCP [TCP segment of a reassembled PDU]
213   2.473428 192.168.23.32 -> 192.168.23.172 TCP [TCP segment of a reassembled PDU]
214   2.473558 192.168.23.32 -> 192.168.23.172 TCP [TCP segment of a reassembled PDU]
215   2.473677 192.168.23.32 -> 192.168.23.172 TCP [TCP segment of a reassembled PDU]
216   2.473803 192.168.23.32 -> 192.168.23.172 TCP [TCP segment of a reassembled PDU]
217   2.473918 192.168.23.32 -> 192.168.23.172 TCP [TCP segment of a reassembled PDU]
218   2.474048 192.168.23.32 -> 192.168.23.172 TCP [TCP segment of a reassembled PDU]
219   2.474164 192.168.23.32 -> 192.168.23.172 TCP [TCP segment of a reassembled PDU]
220   2.474294 192.168.23.32 -> 192.168.23.172 TCP [TCP segment of a reassembled PDU]
221   2.474425 192.168.23.32 -> 192.168.23.172 TCP [TCP segment of a reassembled PDU]
222   2.474540 192.168.23.32 -> 192.168.23.172 TCP [TCP segment of a reassembled PDU]
223   2.474671 192.168.23.32 -> 192.168.23.172 TCP [TCP segment of a reassembled PDU]
224   2.474785 192.168.23.32 -> 192.168.23.172 TCP [TCP segment of a reassembled PDU]
225   2.474916 192.168.23.32 -> 192.168.23.172 TCP [TCP segment of a reassembled PDU]
226   2.475032 192.168.23.32 -> 192.168.23.172 TCP [TCP segment of a reassembled PDU]
227   2.475161 192.168.23.32 -> 192.168.23.172 TCP [TCP segment of a reassembled PDU]
228   2.475278 192.168.23.32 -> 192.168.23.172 TCP [TCP segment of a reassembled PDU]
229   2.475408 192.168.23.32 -> 192.168.23.172 TCP [TCP segment of a reassembled PDU]
230   2.475524 192.168.23.32 -> 192.168.23.172 TCP [TCP segment of a reassembled PDU]
231   2.475655 192.168.23.32 -> 192.168.23.172 TCP [TCP segment of a reassembled PDU]
232   2.475771 192.168.23.32 -> 192.168.23.172 TCP [TCP segment of a reassembled PDU]
233   2.486863 192.168.23.172 -> 192.168.23.32 TCP 49567 > http [ACK] Seq=126 Ack=179553 Win=78208 Len=0 TSval=620664 TSecr=2141929983
234   2.497668 192.168.23.172 -> 192.168.23.32 TCP 49567 > http [ACK] Seq=126 Ack=182449 Win=78208 Len=0 TSval=620666 TSecr=2141929983
235   2.497928 192.168.23.172 -> 192.168.23.32 TCP 49567 > http [ACK] Seq=126 Ack=186793 Win=84096 Len=0 TSval=620666 TSecr=2141929986
236   2.498220 192.168.23.172 -> 192.168.23.32 TCP 49567 > http [ACK] Seq=126 Ack=189689 Win=84096 Len=0 TSval=620666 TSecr=2141929986
237   2.498449 192.168.23.172 -> 192.168.23.32 TCP 49567 > http [ACK] Seq=126 Ack=192585 Win=84096 Len=0 TSval=620666 TSecr=2141929986
238   2.498710 192.168.23.172 -> 192.168.23.32 TCP 49567 > http [ACK] Seq=126 Ack=195481 Win=84096 Len=0 TSval=620667 TSecr=2141929986
239   2.498943 192.168.23.172 -> 192.168.23.32 TCP 49567 > http [ACK] Seq=126 Ack=198377 Win=84096 Len=0 TSval=620667 TSecr=2141929986
240   2.499185 192.168.23.172 -> 192.168.23.32 TCP 49567 > http [ACK] Seq=126 Ack=201273 Win=84096 Len=0 TSval=620667 TSecr=2141929986
241   2.499446 192.168.23.172 -> 192.168.23.32 TCP 49567 > http [ACK] Seq=126 Ack=204169 Win=84096 Len=0 TSval=620667 TSecr=2141929986
242   2.499693 192.168.23.172 -> 192.168.23.32 TCP 49567 > http [ACK] Seq=126 Ack=207065 Win=84096 Len=0 TSval=620667 TSecr=2141929986
243   2.499938 192.168.23.172 -> 192.168.23.32 TCP 49567 > http [ACK] Seq=126 Ack=209961 Win=84096 Len=0 TSval=620667 TSecr=2141929986
244   2.500181 192.168.23.172 -> 192.168.23.32 TCP 49567 > http [ACK] Seq=126 Ack=212857 Win=84096 Len=0 TSval=620667 TSecr=2141929986
245   2.500429 192.168.23.172 -> 192.168.23.32 TCP 49567 > http [ACK] Seq=126 Ack=215753 Win=84096 Len=0 TSval=620667 TSecr=2141929986
246   2.500675 192.168.23.172 -> 192.168.23.32 TCP 49567 > http [ACK] Seq=126 Ack=218649 Win=84096 Len=0 TSval=620667 TSecr=2141929986
247   2.512541 192.168.23.32 -> 192.168.23.172 TCP [TCP segment of a reassembled PDU]
248   2.523248 192.168.23.32 -> 192.168.23.172 TCP [TCP segment of a reassembled PDU]
249   2.523359 192.168.23.32 -> 192.168.23.172 TCP [TCP segment of a reassembled PDU]
250   2.523463 192.168.23.32 -> 192.168.23.172 TCP [TCP segment of a reassembled PDU]
251   2.523595 192.168.23.32 -> 192.168.23.172 TCP [TCP segment of a reassembled PDU]
252   2.523710 192.168.23.32 -> 192.168.23.172 TCP [TCP segment of a reassembled PDU]
253   2.523837 192.168.23.32 -> 192.168.23.172 TCP [TCP segment of a reassembled PDU]
254   2.523958 192.168.23.32 -> 192.168.23.172 TCP [TCP segment of a reassembled PDU]
255   2.524130 192.168.23.32 -> 192.168.23.172 TCP [TCP segment of a reassembled PDU]
256   2.524180 192.168.23.32 -> 192.168.23.172 TCP [TCP segment of a reassembled PDU]
257   2.524336 192.168.23.32 -> 192.168.23.172 TCP [TCP segment of a reassembled PDU]
258   2.524449 192.168.23.32 -> 192.168.23.172 TCP [TCP segment of a reassembled PDU]
259   2.524578 192.168.23.32 -> 192.168.23.172 TCP [TCP segment of a reassembled PDU]
260   2.524703 192.168.23.32 -> 192.168.23.172 TCP [TCP segment of a reassembled PDU]
261   2.524824 192.168.23.32 -> 192.168.23.172 TCP [TCP segment of a reassembled PDU]
262   2.524954 192.168.23.32 -> 192.168.23.172 TCP [TCP segment of a reassembled PDU]
263   2.525066 192.168.23.32 -> 192.168.23.172 TCP [TCP segment of a reassembled PDU]
264   2.525199 192.168.23.32 -> 192.168.23.172 TCP [TCP segment of a reassembled PDU]
265   2.525313 192.168.23.32 -> 192.168.23.172 TCP [TCP segment of a reassembled PDU]
266   2.525444 192.168.23.32 -> 192.168.23.172 TCP [TCP segment of a reassembled PDU]
267   2.525559 192.168.23.32 -> 192.168.23.172 TCP [TCP segment of a reassembled PDU]
268   2.525692 192.168.23.32 -> 192.168.23.172 TCP [TCP segment of a reassembled PDU]
269   2.525805 192.168.23.32 -> 192.168.23.172 TCP [TCP segment of a reassembled PDU]
270   2.525936 192.168.23.32 -> 192.168.23.172 TCP [TCP segment of a reassembled PDU]
271   2.526051 192.168.23.32 -> 192.168.23.172 TCP [TCP segment of a reassembled PDU]
272   2.526181 192.168.23.32 -> 192.168.23.172 TCP [TCP segment of a reassembled PDU]
273   2.526296 192.168.23.32 -> 192.168.23.172 TCP [TCP segment of a reassembled PDU]
274   2.526427 192.168.23.32 -> 192.168.23.172 TCP [TCP segment of a reassembled PDU]
275   2.526543 192.168.23.32 -> 192.168.23.172 TCP [TCP segment of a reassembled PDU]
276   2.526673 192.168.23.32 -> 192.168.23.172 TCP [TCP segment of a reassembled PDU]
277   2.537625 192.168.23.172 -> 192.168.23.32 TCP 49567 > http [ACK] Seq=126 Ack=222993 Win=84096 Len=0 TSval=620676 TSecr=2141929986
278   2.548449 192.168.23.172 -> 192.168.23.32 TCP 49567 > http [ACK] Seq=126 Ack=225889 Win=84096 Len=0 TSval=620679 TSecr=2141929998
279   2.548625 192.168.23.172 -> 192.168.23.32 TCP 49567 > http [ACK] Seq=126 Ack=228785 Win=84096 Len=0 TSval=620679 TSecr=2141929998
280   2.548860 192.168.23.172 -> 192.168.23.32 TCP 49567 > http [ACK] Seq=126 Ack=231681 Win=84096 Len=0 TSval=620679 TSecr=2141929998
281   2.549173 192.168.23.172 -> 192.168.23.32 TCP 49567 > http [ACK] Seq=126 Ack=234577 Win=84096 Len=0 TSval=620679 TSecr=2141929998
282   2.549360 192.168.23.172 -> 192.168.23.32 TCP 49567 > http [ACK] Seq=126 Ack=237473 Win=84096 Len=0 TSval=620679 TSecr=2141929998
283   2.549601 192.168.23.172 -> 192.168.23.32 TCP 49567 > http [ACK] Seq=126 Ack=240369 Win=84096 Len=0 TSval=620679 TSecr=2141929999
284   2.549847 192.168.23.172 -> 192.168.23.32 TCP 49567 > http [ACK] Seq=126 Ack=243265 Win=84096 Len=0 TSval=620679 TSecr=2141929999
285   2.550087 192.168.23.172 -> 192.168.23.32 TCP 49567 > http [ACK] Seq=126 Ack=246161 Win=84096 Len=0 TSval=620679 TSecr=2141929999
286   2.550334 192.168.23.172 -> 192.168.23.32 TCP 49567 > http [ACK] Seq=126 Ack=249057 Win=84096 Len=0 TSval=620679 TSecr=2141929999
287   2.550581 192.168.23.172 -> 192.168.23.32 TCP 49567 > http [ACK] Seq=126 Ack=251953 Win=84096 Len=0 TSval=620679 TSecr=2141929999
288   2.550826 192.168.23.172 -> 192.168.23.32 TCP 49567 > http [ACK] Seq=126 Ack=254849 Win=84096 Len=0 TSval=620680 TSecr=2141929999
289   2.551071 192.168.23.172 -> 192.168.23.32 TCP 49567 > http [ACK] Seq=126 Ack=257745 Win=84096 Len=0 TSval=620680 TSecr=2141929999
290   2.551318 192.168.23.172 -> 192.168.23.32 TCP 49567 > http [ACK] Seq=126 Ack=260641 Win=84096 Len=0 TSval=620680 TSecr=2141929999
291   2.551566 192.168.23.172 -> 192.168.23.32 TCP 49567 > http [ACK] Seq=126 Ack=263537 Win=84096 Len=0 TSval=620680 TSecr=2141929999
292   2.563330 192.168.23.32 -> 192.168.23.172 TCP [TCP segment of a reassembled PDU]
293   2.563526 192.168.23.32 -> 192.168.23.172 TCP [TCP segment of a reassembled PDU]
294   2.574045 192.168.23.32 -> 192.168.23.172 TCP [TCP segment of a reassembled PDU]
295   2.574154 192.168.23.32 -> 192.168.23.172 TCP [TCP segment of a reassembled PDU]
296   2.574287 192.168.23.32 -> 192.168.23.172 TCP [TCP segment of a reassembled PDU]
297   2.574404 192.168.23.32 -> 192.168.23.172 TCP [TCP segment of a reassembled PDU]
298   2.574518 192.168.23.32 -> 192.168.23.172 TCP [TCP segment of a reassembled PDU]
299   2.574647 192.168.23.32 -> 192.168.23.172 TCP [TCP segment of a reassembled PDU]
300   2.574781 192.168.23.32 -> 192.168.23.172 TCP [TCP segment of a reassembled PDU]
301   2.574896 192.168.23.32 -> 192.168.23.172 TCP [TCP segment of a reassembled PDU]
302   2.575008 192.168.23.32 -> 192.168.23.172 TCP [TCP segment of a reassembled PDU]
303   2.575190 192.168.23.32 -> 192.168.23.172 TCP [TCP segment of a reassembled PDU]
304   2.575394 192.168.23.32 -> 192.168.23.172 TCP [TCP segment of a reassembled PDU]
305   2.575505 192.168.23.32 -> 192.168.23.172 TCP [TCP segment of a reassembled PDU]
306   2.575631 192.168.23.32 -> 192.168.23.172 TCP [TCP segment of a reassembled PDU]
307   2.575744 192.168.23.32 -> 192.168.23.172 TCP [TCP segment of a reassembled PDU]
308   2.575873 192.168.23.32 -> 192.168.23.172 TCP [TCP segment of a reassembled PDU]
309   2.575990 192.168.23.32 -> 192.168.23.172 TCP [TCP segment of a reassembled PDU]
310   2.576120 192.168.23.32 -> 192.168.23.172 TCP [TCP segment of a reassembled PDU]
311   2.576236 192.168.23.32 -> 192.168.23.172 TCP [TCP segment of a reassembled PDU]
312   2.576365 192.168.23.32 -> 192.168.23.172 TCP [TCP segment of a reassembled PDU]
313   2.576481 192.168.23.32 -> 192.168.23.172 TCP [TCP segment of a reassembled PDU]
314   2.576614 192.168.23.32 -> 192.168.23.172 TCP [TCP segment of a reassembled PDU]
315   2.576726 192.168.23.32 -> 192.168.23.172 TCP [TCP segment of a reassembled PDU]
316   2.576861 192.168.23.32 -> 192.168.23.172 TCP [TCP segment of a reassembled PDU]
317   2.576972 192.168.23.32 -> 192.168.23.172 TCP [TCP segment of a reassembled PDU]
318   2.577102 192.168.23.32 -> 192.168.23.172 TCP [TCP segment of a reassembled PDU]
319   2.577217 192.168.23.32 -> 192.168.23.172 TCP [TCP segment of a reassembled PDU]
320   2.577350 192.168.23.32 -> 192.168.23.172 TCP [TCP segment of a reassembled PDU]
321   2.577463 192.168.23.32 -> 192.168.23.172 TCP [TCP segment of a reassembled PDU]
322   2.588399 192.168.23.172 -> 192.168.23.32 TCP 49567 > http [ACK] Seq=126 Ack=267881 Win=84096 Len=0 TSval=620689 TSecr=2141929999
323   2.599122 192.168.23.172 -> 192.168.23.32 TCP 49567 > http [ACK] Seq=126 Ack=270777 Win=84096 Len=0 TSval=620692 TSecr=2141930008
324   2.599175 192.168.23.172 -> 192.168.23.32 TCP 49567 > http [ACK] Seq=126 Ack=272225 Win=86912 Len=0 TSval=620692 TSecr=2141930011
325   2.599320 192.168.23.172 -> 192.168.23.32 TCP 49567 > http [ACK] Seq=126 Ack=273673 Win=89856 Len=0 TSval=620692 TSecr=2141930011
326   2.599557 192.168.23.172 -> 192.168.23.32 TCP 49567 > http [ACK] Seq=126 Ack=276569 Win=89856 Len=0 TSval=620692 TSecr=2141930011
327   2.599807 192.168.23.172 -> 192.168.23.32 TCP 49567 > http [ACK] Seq=126 Ack=279465 Win=89856 Len=0 TSval=620692 TSecr=2141930011
328   2.600031 192.168.23.172 -> 192.168.23.32 TCP 49567 > http [ACK] Seq=126 Ack=282361 Win=89856 Len=0 TSval=620692 TSecr=2141930011
329   2.600232 192.168.23.172 -> 192.168.23.32 TCP 49567 > http [ACK] Seq=126 Ack=285257 Win=89856 Len=0 TSval=620692 TSecr=2141930011
330   2.600542 192.168.23.172 -> 192.168.23.32 TCP 49567 > http [ACK] Seq=126 Ack=288153 Win=89856 Len=0 TSval=620692 TSecr=2141930011
331   2.600772 192.168.23.172 -> 192.168.23.32 TCP 49567 > http [ACK] Seq=126 Ack=291049 Win=89856 Len=0 TSval=620692 TSecr=2141930011
332   2.601017 192.168.23.172 -> 192.168.23.32 TCP 49567 > http [ACK] Seq=126 Ack=293945 Win=89856 Len=0 TSval=620692 TSecr=2141930011
333   2.601260 192.168.23.172 -> 192.168.23.32 TCP 49567 > http [ACK] Seq=126 Ack=296841 Win=89856 Len=0 TSval=620692 TSecr=2141930011
334   2.601506 192.168.23.172 -> 192.168.23.32 TCP 49567 > http [ACK] Seq=126 Ack=299737 Win=89856 Len=0 TSval=620692 TSecr=2141930011
335   2.601749 192.168.23.172 -> 192.168.23.32 TCP 49567 > http [ACK] Seq=126 Ack=302633 Win=89856 Len=0 TSval=620692 TSecr=2141930012
336   2.602000 192.168.23.172 -> 192.168.23.32 TCP 49567 > http [ACK] Seq=126 Ack=305529 Win=89856 Len=0 TSval=620692 TSecr=2141930012
337   2.602243 192.168.23.172 -> 192.168.23.32 TCP 49567 > http [ACK] Seq=126 Ack=308425 Win=89856 Len=0 TSval=620692 TSecr=2141930012
338   2.602488 192.168.23.172 -> 192.168.23.32 TCP 49567 > http [ACK] Seq=126 Ack=311321 Win=89856 Len=0 TSval=620692 TSecr=2141930012
339   2.614002 192.168.23.32 -> 192.168.23.172 TCP [TCP segment of a reassembled PDU]
340   2.614109 192.168.23.32 -> 192.168.23.172 TCP [TCP segment of a reassembled PDU]
341   2.614244 192.168.23.32 -> 192.168.23.172 TCP [TCP segment of a reassembled PDU]
342   2.624751 192.168.23.32 -> 192.168.23.172 TCP [TCP segment of a reassembled PDU]
343   2.624840 192.168.23.32 -> 192.168.23.172 TCP [TCP segment of a reassembled PDU]
344   2.624997 192.168.23.32 -> 192.168.23.172 TCP [TCP segment of a reassembled PDU]
345   2.625119 192.168.23.32 -> 192.168.23.172 TCP [TCP segment of a reassembled PDU]
346   2.625218 192.168.23.32 -> 192.168.23.172 TCP [TCP segment of a reassembled PDU]
347   2.625352 192.168.23.32 -> 192.168.23.172 TCP [TCP segment of a reassembled PDU]
348   2.625482 192.168.23.32 -> 192.168.23.172 TCP [TCP segment of a reassembled PDU]
349   2.625593 192.168.23.32 -> 192.168.23.172 TCP [TCP segment of a reassembled PDU]
350   2.625708 192.168.23.32 -> 192.168.23.172 TCP [TCP segment of a reassembled PDU]
351   2.625839 192.168.23.32 -> 192.168.23.172 TCP [TCP segment of a reassembled PDU]
352   2.625954 192.168.23.32 -> 192.168.23.172 TCP [TCP segment of a reassembled PDU]
353   2.626085 192.168.23.32 -> 192.168.23.172 TCP [TCP segment of a reassembled PDU]
354   2.626200 192.168.23.32 -> 192.168.23.172 TCP [TCP segment of a reassembled PDU]
355   2.626330 192.168.23.32 -> 192.168.23.172 TCP [TCP segment of a reassembled PDU]
356   2.626445 192.168.23.32 -> 192.168.23.172 TCP [TCP segment of a reassembled PDU]
357   2.626576 192.168.23.32 -> 192.168.23.172 TCP [TCP segment of a reassembled PDU]
358   2.626691 192.168.23.32 -> 192.168.23.172 TCP [TCP segment of a reassembled PDU]
359   2.626821 192.168.23.32 -> 192.168.23.172 TCP [TCP segment of a reassembled PDU]
360   2.626986 192.168.23.32 -> 192.168.23.172 TCP [TCP segment of a reassembled PDU]
361   2.627133 192.168.23.32 -> 192.168.23.172 TCP [TCP segment of a reassembled PDU]
362   2.627264 192.168.23.32 -> 192.168.23.172 TCP [TCP segment of a reassembled PDU]
363   2.627378 192.168.23.32 -> 192.168.23.172 TCP [TCP segment of a reassembled PDU]
364   2.627510 192.168.23.32 -> 192.168.23.172 TCP [TCP segment of a reassembled PDU]
365   2.627624 192.168.23.32 -> 192.168.23.172 TCP [TCP segment of a reassembled PDU]
366   2.627755 192.168.23.32 -> 192.168.23.172 TCP [TCP segment of a reassembled PDU]
367   2.627870 192.168.23.32 -> 192.168.23.172 TCP [TCP segment of a reassembled PDU]
368   2.628001 192.168.23.32 -> 192.168.23.172 TCP [TCP segment of a reassembled PDU]
369   2.628115 192.168.23.32 -> 192.168.23.172 TCP [TCP segment of a reassembled PDU]
370   2.628259 192.168.23.32 -> 192.168.23.172 TCP [TCP segment of a reassembled PDU]
371   2.628370 192.168.23.32 -> 192.168.23.172 TCP [TCP segment of a reassembled PDU]
372   2.628500 192.168.23.32 -> 192.168.23.172 TCP [TCP segment of a reassembled PDU]
373   2.628615 192.168.23.32 -> 192.168.23.172 TCP [TCP segment of a reassembled PDU]
374   2.639163 192.168.23.172 -> 192.168.23.32 TCP 49567 > http [ACK] Seq=126 Ack=314217 Win=89856 Len=0 TSval=620702 TSecr=2141930021
375   2.649834 192.168.23.172 -> 192.168.23.32 TCP 49567 > http [ACK] Seq=126 Ack=317113 Win=89856 Len=0 TSval=620704 TSecr=2141930021
376   2.649903 192.168.23.172 -> 192.168.23.32 TCP 49567 > http [ACK] Seq=126 Ack=318561 Win=92672 Len=0 TSval=620704 TSecr=2141930024
377   2.650141 192.168.23.172 -> 192.168.23.32 TCP 49567 > http [ACK] Seq=126 Ack=321457 Win=92672 Len=0 TSval=620704 TSecr=2141930024
378   2.650369 192.168.23.172 -> 192.168.23.32 TCP 49567 > http [ACK] Seq=126 Ack=324353 Win=92672 Len=0 TSval=620704 TSecr=2141930024
379   2.650605 192.168.23.172 -> 192.168.23.32 TCP 49567 > http [ACK] Seq=126 Ack=327249 Win=92672 Len=0 TSval=620704 TSecr=2141930024
380   2.650852 192.168.23.172 -> 192.168.23.32 TCP 49567 > http [ACK] Seq=126 Ack=330145 Win=92672 Len=0 TSval=620705 TSecr=2141930024
381   2.651095 192.168.23.172 -> 192.168.23.32 TCP 49567 > http [ACK] Seq=126 Ack=333041 Win=92672 Len=0 TSval=620705 TSecr=2141930024
382   2.651342 192.168.23.172 -> 192.168.23.32 TCP 49567 > http [ACK] Seq=126 Ack=335937 Win=92672 Len=0 TSval=620705 TSecr=2141930024
383   2.651588 192.168.23.172 -> 192.168.23.32 TCP 49567 > http [ACK] Seq=126 Ack=338833 Win=92672 Len=0 TSval=620705 TSecr=2141930024
384   2.651832 192.168.23.172 -> 192.168.23.32 TCP 49567 > http [ACK] Seq=126 Ack=341729 Win=92672 Len=0 TSval=620705 TSecr=2141930024
385   2.652148 192.168.23.172 -> 192.168.23.32 TCP 49567 > http [ACK] Seq=126 Ack=344625 Win=92672 Len=0 TSval=620705 TSecr=2141930024
386   2.652395 192.168.23.172 -> 192.168.23.32 TCP 49567 > http [ACK] Seq=126 Ack=347521 Win=92672 Len=0 TSval=620705 TSecr=2141930024
